{
  "hardware": [
    {
      "id": "rtx-pro-4000-blackwell-24gb",
      "match_scope": "family"
    }
  ],
  "id": "rtx-pro-4000-blackwell--us",
  "observations": [
    {
      "amount": 3099.99,
      "condition": "new",
      "currency": "USD",
      "in_stock": true,
      "observed_at": "2026-08-31T12:09:51Z",
      "quantity": 3,
      "retailer": "microcenter",
      "title": "NVIDIA GeForce RTX Pro 4000 Blackwell Single-Fan AI & Workstation Graphics Card (OEM) 24GB GDDR7",
      "url": "https://www.microcenter.com/product/711670/nvidia-geforce-rtx-pro-4000-blackwell-single-fan-ai-workstation-graphics-card-%28oem%29"
    }
  ],
  "observed_at": "2026-08-31T12:09:51Z",
  "product": {
    "category": "gpu",
    "id": "rtx-pro-4000-blackwell",
    "name": "RTX Pro 4000 blackwell"
  },
  "provenance": {
    "scanner": "https://claude.ai/code/routines",
    "snapshot_generated_at": "2026-09-21T10:14:00Z",
    "source_error_count": 1
  },
  "region": {
    "code": "US",
    "currency": "USD",
    "name": "United States"
  },
  "schema_version": "local-ai-registry/v1",
  "summary": {
    "in_stock_count": 1,
    "listing_count": 1,
    "lowest_new": 3099.99,
    "lowest_refurbished": null,
    "lowest_used": null,
    "retailer_count": 1
  },
  "verification": {
    "method": "scheduled claude cloud routine: live web search, native currency, direct retailer URLs, 0.35x-3x plausibility vs prior lowest-new, merged with prior observations",
    "rejected_observations": 0,
    "state": "candidate"
  }
}
