{
  "hardware": [
    {
      "id": "rx-9070-xt-16gb",
      "match_scope": "family"
    }
  ],
  "id": "rx-9070-xt--gb",
  "observations": [
    {
      "amount": 724.99,
      "condition": "new",
      "currency": "GBP",
      "in_stock": true,
      "observed_at": "2026-08-29T22:38:49.654Z",
      "quantity": null,
      "retailer": "awd-it",
      "title": "ASUS Prime AMD Radeon RX 9070 XT OC Edition 16GB GDDR6 Graphics Card - 90YV0L71-M0NA00",
      "url": "https://www.awd-it.co.uk/asus-prime-radeon-rx-9070-xt-oc-edition-16gb-gddr6-prime-rx9070xt-o16g.html"
    },
    {
      "amount": 744.95,
      "condition": "new",
      "currency": "GBP",
      "in_stock": true,
      "observed_at": "2026-08-29T22:38:49.654Z",
      "quantity": null,
      "retailer": "awd-it",
      "title": "XFX Quicksilver AMD Radeon RX 9070 XT  White 16GB GDDR6 Gaming Graphics Card - RX-97TQICKW9",
      "url": "https://www.awd-it.co.uk/xfx-quicksilver-amd-radeon-rx-9070-xt-white-16gb-gddr6-gaming-graphics-card-rx-97tqickw9.html"
    },
    {
      "amount": 745.95,
      "condition": "new",
      "currency": "GBP",
      "in_stock": true,
      "observed_at": "2026-08-29T22:38:49.654Z",
      "quantity": null,
      "retailer": "awd-it",
      "title": "Gigabyte AORUS Radeon RX 9070 XT ELITE 16G GDDR6 16GB Graphics Card - GV-R9070XTAORUS E-16GD",
      "url": "https://www.awd-it.co.uk/gigabyte-aorus-radeon-rx-9070-xt-elite-16g-gddr6-16gb-graphics-card-gv-r9070xtaorus-e-16gd.html"
    },
    {
      "amount": 768.95,
      "condition": "new",
      "currency": "GBP",
      "in_stock": true,
      "observed_at": "2026-08-29T22:38:49.653Z",
      "quantity": null,
      "retailer": "awd-it",
      "title": "XFX Mercury AMD Radeon RX 9070 XT OC 16GB GDDR6 Gaming Graphics Card - RX-97TRGBBB9",
      "url": "https://www.awd-it.co.uk/xfx-mercury-amd-radeon-rx-9070xt-oc-16gb-gddr6-gaming-graphics-card-rx-97trgbbb9.html"
    },
    {
      "amount": 788.95,
      "condition": "new",
      "currency": "GBP",
      "in_stock": true,
      "observed_at": "2026-08-29T22:38:49.654Z",
      "quantity": null,
      "retailer": "awd-it",
      "title": "Gigabyte Radeon RX 9070 XT GAMING  16G GDDR6 16GB Graphics Card - GV-R9070XTGAMING-16GD",
      "url": "https://www.awd-it.co.uk/gigabyte-radeon-rx-9070-xt-gaming-16g-gddr6-16gb-graphics-card-gv-r9070xtgaming-16gd.html"
    },
    {
      "amount": 825.99,
      "condition": "new",
      "currency": "GBP",
      "in_stock": true,
      "observed_at": "2026-08-29T22:38:49.654Z",
      "quantity": null,
      "retailer": "awd-it",
      "title": "ASRock AMD Radeon RX 9070 XT Steel Legend 16GB GDDR6 Graphics Card - 90-GA5DZZ-00UANF",
      "url": "https://www.awd-it.co.uk/asrock-amd-radeon-rx-9070-xt-steel-legend-16gb-gddr6-graphics-card-90-ga5dzz-00uanf.html"
    },
    {
      "amount": 1349.99,
      "condition": "new",
      "currency": "GBP",
      "in_stock": null,
      "observed_at": "2026-08-29T22:38:49.654Z",
      "quantity": null,
      "retailer": "awd-it",
      "title": "AWD-IT Solar Ryzen 7 5700X AMD Radeon RX 9070 XT 16GB Desktop PC for Gaming",
      "url": "https://www.awd-it.co.uk/awd-p400a-ryzen-5-5600x-six-core-nvidia-rtx-3060ti-desktop-pc.html"
    },
    {
      "amount": 1749.99,
      "condition": "new",
      "currency": "GBP",
      "in_stock": null,
      "observed_at": "2026-08-29T22:38:49.654Z",
      "quantity": null,
      "retailer": "awd-it",
      "title": "AWD-IT Evolution RX AMD Ryzen 5 9600X Six Core Radeon RX 9070 XT 16GB Desktop PC for Gaming",
      "url": "https://www.awd-it.co.uk/awd-it-evolution-rx-amd-ryzen-5-9600-six-core-radeon-rx-9070-xt-16gb-desktop-pc-for-gaming.html"
    }
  ],
  "observed_at": "2026-08-29T22:38:49.654Z",
  "product": {
    "category": "gpu",
    "id": "rx-9070-xt",
    "name": "RX 9070 xt"
  },
  "provenance": {
    "scanner": "https://github.com/0xSero/local-ai-scanner-cli",
    "snapshot_generated_at": "2026-08-29T22:45:49.751Z",
    "source_error_count": 0
  },
  "region": {
    "code": "GB",
    "currency": "GBP",
    "name": "United Kingdom"
  },
  "schema_version": "local-ai-registry/v1",
  "summary": {
    "in_stock_count": 6,
    "listing_count": 8,
    "lowest_new": 724.99,
    "lowest_refurbished": null,
    "lowest_used": null,
    "retailer_count": 1
  },
  "verification": {
    "method": "retailer query result with regional currency and robust lower-outlier rejection",
    "rejected_observations": 0,
    "state": "candidate"
  }
}
