{
  "hardware": [
    {
      "id": "apple-m1-max-32gb",
      "match_scope": "family"
    },
    {
      "id": "apple-m1-max-64gb",
      "match_scope": "family"
    }
  ],
  "id": "macbook-pro-m1-max--jp",
  "observations": [
    {
      "amount": 435800.0,
      "condition": "new",
      "currency": "JPY",
      "in_stock": true,
      "observed_at": "2026-08-31T16:20:00Z",
      "quantity": null,
      "retailer": "sofmap.com",
      "title": "MacBook Pro 16インチ Apple M1 Maxチップ搭載モデル [2021年モデル/SSD 1TB/メモリ 32GB/10コアCPUと32コアGPU] スペースグレイ MK1A3J/A",
      "url": "https://www.sofmap.com/product_detail.aspx?sku=22710744"
    }
  ],
  "observed_at": "2026-08-31T16:20:00Z",
  "product": {
    "category": "apple",
    "id": "macbook-pro-m1-max",
    "name": "MacBook Pro M1 Max"
  },
  "provenance": {
    "scanner": "https://github.com/openai/codex",
    "snapshot_generated_at": "2026-08-31T16:20:00Z",
    "source_error_count": 32
  },
  "region": {
    "code": "JP",
    "currency": "JPY",
    "name": "Japan"
  },
  "schema_version": "local-ai-registry/v1",
  "summary": {
    "in_stock_count": 1,
    "listing_count": 1,
    "lowest_new": 435800.0,
    "lowest_refurbished": null,
    "lowest_used": null,
    "retailer_count": 1
  },
  "verification": {
    "method": "codex-cli (gpt-5.6-terra) live web search with per-region subagents; gated by validate_research.py: structure, native currency, https product URL, ISO timestamps, and plausibility vs prior lowest-new (0.35x-3x); URLs verified reachable; pre-existing scanner observations retained and merged",
    "rejected_observations": 0,
    "state": "candidate"
  }
}
