{
  "hardware": [
    {
      "id": "rtx-4090-24gb",
      "match_scope": "family"
    }
  ],
  "id": "rtx-4090--us",
  "observations": [
    {
      "amount": 3898,
      "condition": "new",
      "currency": "USD",
      "in_stock": true,
      "observed_at": "2026-08-31T11:49:17.000Z",
      "quantity": null,
      "retailer": "newegg",
      "title": "NVIDIA GeForce RTX 4090 Founders Edition 24GB GDDR6X GeForce RTX 4090 FE",
      "url": "https://www.newegg.com/nvidia-geforce-rtx-4090-24gb-graphics-card/p/1WK-00TY-00016?item=9SIBSTNK2G9429"
    },
    {
      "amount": 3565.0,
      "condition": "new",
      "currency": "USD",
      "in_stock": null,
      "observed_at": "2026-09-07T10:10:30Z",
      "quantity": null,
      "retailer": "newegg",
      "title": "Asus TUF Gaming GeForce RTX 4090 Graphics Card PCIe 4.0 24GB",
      "url": "https://www.newegg.com/asus-tuf-gaming-tuf-rtx4090-24g-gaming-geforce-rtx-4090-24gb-graphics-card-triple-fans/p/N82E16814126596"
    },
    {
      "amount": 3495.0,
      "condition": "new",
      "currency": "USD",
      "in_stock": null,
      "observed_at": "2026-09-07T10:10:30Z",
      "quantity": null,
      "retailer": "newegg",
      "title": "MSI GAMING TRIO 24G GeForce RTX 4090 Graphics Card PCIe 4.0 24GB",
      "url": "https://www.newegg.com/msi-rtx-4090-gaming-trio-24g-geforce-rtx-4090-24gb-graphics-card-triple-fans/p/N82E16814137762"
    },
    {
      "amount": 3750.0,
      "condition": "new",
      "currency": "USD",
      "in_stock": null,
      "observed_at": "2026-09-07T10:10:30Z",
      "quantity": null,
      "retailer": "newegg",
      "title": "MSI GAMING X TRIO 24G GeForce RTX 4090 Graphics Card PCIe 4.0 24GB",
      "url": "https://www.newegg.com/msi-rtx-4090-gaming-x-trio-24g-geforce-rtx-4090-24gb-graphics-card-triple-fans/p/N82E16814137761"
    }
  ],
  "observed_at": "2026-09-07T10:10:30Z",
  "product": {
    "category": "gpu",
    "id": "rtx-4090",
    "name": "RTX 4090"
  },
  "provenance": {
    "scanner": "https://claude.ai/code/routines",
    "snapshot_generated_at": "2026-09-07T10:10:30Z",
    "source_error_count": 0
  },
  "region": {
    "code": "US",
    "currency": "USD",
    "name": "United States"
  },
  "schema_version": "local-ai-registry/v1",
  "summary": {
    "in_stock_count": 1,
    "listing_count": 4,
    "lowest_new": 3495.0,
    "lowest_refurbished": null,
    "lowest_used": null,
    "retailer_count": 1
  },
  "verification": {
    "method": "scheduled claude cloud routine: live web search, native currency, direct retailer URLs, 0.35x-3x plausibility vs prior lowest-new, merged with prior observations",
    "rejected_observations": 0,
    "state": "candidate"
  }
}
