{
  "hardware": [
    {
      "id": "rtx-pro-4000-blackwell-24gb",
      "match_scope": "family"
    }
  ],
  "id": "rtx-pro-4000-blackwell--pl",
  "observations": [
    {
      "amount": 9999.0,
      "condition": "new",
      "currency": "PLN",
      "in_stock": true,
      "observed_at": "2026-09-01T04:30:35.346Z",
      "quantity": null,
      "retailer": "ceneo",
      "title": "Pny Technologies Emaga PNY RTX PRO 4000 Blackwell, 24 GB GDDR7 (VCNRTXPRO4000SB)",
      "url": "https://www.ceneo.pl/190031990?utm_medium=organic&utm_source=listing_carousel&utm_content=/Komputery;szukaj-rtx+pro+4000+blackwell"
    },
    {
      "amount": 10803.58,
      "condition": "new",
      "currency": "PLN",
      "in_stock": true,
      "observed_at": "2026-09-01T04:30:35.346Z",
      "quantity": null,
      "retailer": "ceneo",
      "title": "Pny Technologies PNY RTX PRO 4000 Blackwell SFF (VCNRTXPRO4000LPPB)",
      "url": "https://www.ceneo.pl/194170689?utm_medium=organic&utm_source=listing_carousel&utm_content=/Komputery;szukaj-rtx+pro+4000+blackwell"
    },
    {
      "amount": 10998.99,
      "condition": "new",
      "currency": "PLN",
      "in_stock": true,
      "observed_at": "2026-09-01T04:30:35.346Z",
      "quantity": null,
      "retailer": "ceneo",
      "title": "Lenovo RTX PRO 4000 Blackwell 24GB DP*4 GDDR7 (4X61T95636)",
      "url": "https://www.ceneo.pl/197468283?utm_medium=organic&utm_source=listing_carousel&utm_content=/Komputery;szukaj-rtx+pro+4000+blackwell"
    },
    {
      "amount": 11064.82,
      "condition": "new",
      "currency": "PLN",
      "in_stock": true,
      "observed_at": "2026-09-01T04:30:35.345Z",
      "quantity": null,
      "retailer": "ceneo",
      "title": "Pny Technologies RTX PRO 4000 Blackwell, 24 GB (VCNRTXPRO4000PB)",
      "url": "https://www.ceneo.pl/189861512?utm_medium=organic&utm_source=listing_carousel&utm_content=/Komputery;szukaj-rtx+pro+4000+blackwell"
    },
    {
      "amount": 11299.0,
      "condition": "new",
      "currency": "PLN",
      "in_stock": true,
      "observed_at": "2026-09-01T04:30:35.346Z",
      "quantity": null,
      "retailer": "ceneo",
      "title": "Nvidia RTX PRO 4000 Blackwell 24GB GDDR7 Retail (9005G1472570000)",
      "url": "https://www.ceneo.pl/190947447?utm_medium=organic&utm_source=listing_carousel&utm_content=/Komputery;szukaj-rtx+pro+4000+blackwell"
    },
    {
      "amount": 11299.0,
      "condition": "new",
      "currency": "PLN",
      "in_stock": true,
      "observed_at": "2026-09-01T04:30:35.346Z",
      "quantity": null,
      "retailer": "ceneo",
      "title": "Nvidia RTX PRO 4000 SFF Blackwell Retail 24GB GDDR7 (9005G1952501000)",
      "url": "https://www.ceneo.pl/194170693?utm_medium=organic&utm_source=listing_carousel&utm_content=/Komputery;szukaj-rtx+pro+4000+blackwell"
    },
    {
      "amount": 14636.98,
      "condition": "new",
      "currency": "PLN",
      "in_stock": true,
      "observed_at": "2026-09-01T04:30:35.345Z",
      "quantity": null,
      "retailer": "ceneo",
      "title": "Pny Technologies Emaga RTX PRO 4000 Blackwell, 24 GB (VCNRTXPRO4000PB)",
      "url": "https://www.ceneo.pl/189861514?utm_medium=organic&utm_source=listing_carousel&utm_content=/Komputery;szukaj-rtx+pro+4000+blackwell"
    }
  ],
  "observed_at": "2026-09-01T04:30:35.346Z",
  "product": {
    "category": "gpu",
    "id": "rtx-pro-4000-blackwell",
    "name": "RTX Pro 4000 blackwell"
  },
  "provenance": {
    "scanner": "https://github.com/0xSero/local-ai-scanner-cli",
    "snapshot_generated_at": "2026-09-01T04:32:01.544Z",
    "source_error_count": 0
  },
  "region": {
    "code": "PL",
    "currency": "PLN",
    "name": "Poland"
  },
  "schema_version": "local-ai-registry/v1",
  "summary": {
    "in_stock_count": 7,
    "listing_count": 7,
    "lowest_new": 9999.0,
    "lowest_refurbished": null,
    "lowest_used": null,
    "retailer_count": 1
  },
  "verification": {
    "method": "retailer query result with regional currency and robust lower-outlier rejection",
    "rejected_observations": 0,
    "state": "candidate"
  }
}
