{
  "schema_version": "local-ai-registry/v1",
  "id": "macbook-pro-m2-max--pl",
  "product": {
    "id": "macbook-pro-m2-max",
    "name": "MacBook Pro M2 Max",
    "category": "apple"
  },
  "region": {
    "code": "PL",
    "name": "Poland",
    "currency": "PLN"
  },
  "hardware": [
    {
      "id": "apple-m2-max-32gb",
      "match_scope": "family"
    },
    {
      "id": "apple-m2-max-64gb",
      "match_scope": "family"
    },
    {
      "id": "apple-m2-max-96gb",
      "match_scope": "family"
    }
  ],
  "observed_at": "2026-08-27T11:28:59.899Z",
  "summary": {
    "listing_count": 3,
    "retailer_count": 2,
    "in_stock_count": 3,
    "lowest_new": 18599,
    "lowest_refurbished": 14799,
    "lowest_used": null
  },
  "observations": [
    {
      "retailer": "apple-refurbished",
      "title": "Odnowiony 14‑calowy MacBook Pro z czipem Apple M2 Max, 12‑rdzeniowym CPU i 30‑rdzeniowym GPU – gwiezdna szarość",
      "condition": "refurbished",
      "amount": 14799,
      "currency": "PLN",
      "in_stock": true,
      "quantity": null,
      "url": "https://www.apple.com/pl/shop/product/fphg3ze/a/odnowiony-14-calowy-macbook-pro-z-czipem-apple-m2-max-12-rdzeniowym-cpu-i-30-rdzeniowym-gpu-gwiezdna-szarość",
      "observed_at": "2026-08-27T11:28:59.893Z"
    },
    {
      "retailer": "apple-refurbished",
      "title": "Odnowiony 14‑calowy MacBook Pro z czipem Apple M2 Max, 12‑rdzeniowym CPU i 38‑rdzeniowym GPU – gwiezdna szarość",
      "condition": "refurbished",
      "amount": 17099,
      "currency": "PLN",
      "in_stock": true,
      "quantity": null,
      "url": "https://www.apple.com/pl/shop/product/g17jcze/a/odnowiony-14-calowy-macbook-pro-z-czipem-apple-m2-max-12-rdzeniowym-cpu-i-38-rdzeniowym-gpu-gwiezdna-szarość",
      "observed_at": "2026-08-27T11:28:59.893Z"
    },
    {
      "retailer": "ceneo",
      "title": "MacBook Pro M2 Max",
      "condition": "new",
      "amount": 18599,
      "currency": "PLN",
      "in_stock": true,
      "quantity": 1,
      "url": "https://www.ceneo.pl/147161596?utm_medium=organic&utm_source=listing_carousel&utm_content=/Komputery;szukaj-macbook+pro+m2+max",
      "observed_at": "2026-08-27T11:28:59.899Z"
    }
  ],
  "verification": {
    "state": "candidate",
    "method": "retailer query result with regional currency and robust lower-outlier rejection",
    "rejected_observations": 0
  },
  "provenance": {
    "scanner": "https://github.com/0xSero/local-ai-scanner-cli",
    "snapshot_generated_at": "2026-08-27T11:32:26.483Z",
    "source_error_count": 75
  }
}
