{
  "schema_version": "local-ai-registry/v1",
  "id": "macbook-pro-m5-max--us",
  "product": {
    "id": "macbook-pro-m5-max",
    "name": "MacBook Pro M5 Max",
    "category": "apple"
  },
  "region": {
    "code": "US",
    "name": "United States",
    "currency": "USD"
  },
  "hardware": [
    {
      "id": "apple-m5-max-128gb",
      "match_scope": "family"
    },
    {
      "id": "apple-m5-max-36gb",
      "match_scope": "family"
    },
    {
      "id": "apple-m5-max-48gb",
      "match_scope": "family"
    },
    {
      "id": "apple-m5-max-64gb",
      "match_scope": "family"
    }
  ],
  "observed_at": "2026-08-27T11:28:59.876Z",
  "summary": {
    "listing_count": 2,
    "retailer_count": 1,
    "in_stock_count": 2,
    "lowest_new": 4099,
    "lowest_refurbished": null,
    "lowest_used": null
  },
  "observations": [
    {
      "retailer": "apple-store",
      "title": "MacBook Pro M5 Max (m5max-18-32)",
      "condition": "new",
      "amount": 4099,
      "currency": "USD",
      "in_stock": true,
      "quantity": null,
      "url": "https://www.apple.com/shop/buy-mac/macbook-pro",
      "observed_at": "2026-08-27T11:28:59.876Z"
    },
    {
      "retailer": "apple-store",
      "title": "MacBook Pro M5 Max (m5max-18-40)",
      "condition": "new",
      "amount": 4699,
      "currency": "USD",
      "in_stock": true,
      "quantity": null,
      "url": "https://www.apple.com/shop/buy-mac/macbook-pro",
      "observed_at": "2026-08-27T11:28:59.876Z"
    }
  ],
  "verification": {
    "state": "candidate",
    "method": "retailer query result with regional currency and robust lower-outlier rejection",
    "rejected_observations": 0
  },
  "provenance": {
    "scanner": "https://github.com/0xSero/local-ai-scanner-cli",
    "snapshot_generated_at": "2026-08-27T11:32:26.483Z",
    "source_error_count": 159
  }
}
