{
  "hardware": [
    {
      "id": "apple-m4-max-128gb",
      "match_scope": "family"
    },
    {
      "id": "apple-m4-max-36gb",
      "match_scope": "family"
    },
    {
      "id": "apple-m4-max-48gb",
      "match_scope": "family"
    },
    {
      "id": "apple-m4-max-64gb",
      "match_scope": "family"
    }
  ],
  "id": "mac-studio-m4-max--us",
  "observations": [
    {
      "amount": 1999,
      "condition": "new",
      "currency": "USD",
      "in_stock": null,
      "observed_at": "2026-08-31T11:49:17.000Z",
      "quantity": null,
      "retailer": "apple",
      "title": "Mac Studio with M4 Max, 14-core CPU, 32-core GPU, 36GB memory, 512GB storage",
      "url": "https://www.apple.com/us/shop/buy-mac/mac-studio/12-core-cpu-30-core-gpu-16-core-neural-engine-32gb-memory-512gb"
    }
  ],
  "observed_at": "2026-08-31T11:49:17.000Z",
  "product": {
    "category": "apple",
    "id": "mac-studio-m4-max",
    "name": "Mac Studio M4 Max"
  },
  "provenance": {
    "scanner": "https://github.com/openai/codex",
    "snapshot_generated_at": "2026-08-31T16:12:00.000Z",
    "source_error_count": 200
  },
  "region": {
    "code": "US",
    "currency": "USD",
    "name": "United States"
  },
  "schema_version": "local-ai-registry/v1",
  "summary": {
    "in_stock_count": 0,
    "listing_count": 1,
    "lowest_new": 1999,
    "lowest_refurbished": null,
    "lowest_used": null,
    "retailer_count": 1
  },
  "verification": {
    "method": "codex-cli (gpt-5.6-terra) live web search with per-region subagents; gated by validate_research.py: structure, native currency, https product URL, ISO timestamps, and plausibility vs prior lowest-new (0.35x-3x); URLs verified reachable; pre-existing scanner observations retained and merged",
    "rejected_observations": 0,
    "state": "candidate"
  }
}
